<Payload xmlns="http://javaops.ru"
         xmlns:xsi="http://www.w3.org/2001/XMLSchema-instance"
         xsi:schemaLocation="http://javaops.ru payload.xsd">
    <Users>
        <User flag="active" city="kiv" email="gmail@gmail.com" groups="topjava08">
            <fullName>Full Name</fullName>
        </User>
        <User flag="superuser" city="spb" email="admin@javaops.ru" groups="topjava07 topjava08 masterjava01 masterjava02">
            <fullName>Admin</fullName>
        </User>
        <User flag="deleted" city="spb" email="mail@yandex.ru">
            <fullName>Deleted</fullName>
        </User>
        <User flag="active" city="tul" email="mail1@yandex.ru" groups="masterjava02">
            <fullName>Mikhail Z</fullName>
        </User>
        <User flag="active" city="msc" email="mail2@yandex.ru" groups="masterjava02">
            <fullName>Max S</fullName>
        </User>
        <User flag="active" city="msc" email="mail3@yandex.ru" groups="masterjava02">
            <fullName>Iliy R</fullName>
        </User>
        <User flag="active" city="tul" email="mail4@gmail.com" groups="masterjava02">
            <fullName>Evgeniia O</fullName>
        </User>
        <User flag="active" city="tul" email="mail5@gmail.com" groups="topjava08">
            <fullName>Alex S</fullName>
        </User>
        <User flag="active" city="tul" email="mail6@gmail.com" groups="masterjava01">
            <fullName>John B</fullName>
        </User>
        <User flag="active" city="msc" email="mail7@gmail.com" groups="masterjava01">
            <fullName>Den N</fullName>
        </User>
    </Users>
    <Cities>
        <City id="spb">Санкт-Петербург</City>
        <City id="msc">Москва</City>
        <City id="tul">Тула</City>
        <City id="kiv">Киев</City>
        <City id="mnsk">Минск</City>
    </Cities>
    <Projects>
        <Project name="topjava" description="topjava description">
            <Groups>
                <Group name="topjava01" status="FINISHED"/>
                <Group name="topjava02" status="FINISHED"/>
                <Group name="topjava03" status="FINISHED"/>
                <Group name="topjava04" status="FINISHED"/>
                <Group name="topjava05" status="FINISHED"/>
                <Group name="topjava06" status="FINISHED"/>
                <Group name="topjava07" status="FINISHED"/>
                <Group name="topjava08" status="CURRENT"/>
                <Group name="topjava09" status="REGISTERING"/>
            </Groups>
        </Project>
        <Project name="masterjava" description="masterjava description">
            <Groups>
                <Group name="masterjava01" status="FINISHED"/>
                <Group name="masterjava02" status="CURRENT"/>
            </Groups>
        </Project>

    </Projects>
</Payload>